{
  "schema_version": "ce-setup-dependency-matrix/v1",
  "artifact_kind": "source-bound-prerequisite-matrix",
  "producer": "scripts/check-ce-localization-review.cjs",
  "public_entrypoint_disposition": "reuse-spec-runtime-setup-only",
  "source_snapshot": {
    "repository": "spec-first",
    "head": "aa40c0f3c16beaa06e492702ff68d6d4c8953271",
    "dirty": false,
    "dirty_paths": [],
    "dirty_path_manifest_sha256": "e3b0c44298fc1c149afbf4c8996fb92427ae41e4649b934ca495991b7852b855",
    "source_tree_hash": "223d4b203bceb0ab828a0942ee7d7b3d9b4e9161ba87e7709c89880fc9293962",
    "inventory_hash": "d39848f1ef49a8a8f87978eee9a971b0ecec1c768b519fd9693b6d63d20ae0fe",
    "scope_contract": {
      "source_roots": [
        "CLAUDE.md",
        "AGENTS.md",
        "skills",
        "templates",
        "src",
        "scripts",
        "tests",
        "docs",
        "README.md",
        "README.en.md",
        "README.zh-CN.md",
        "CHANGELOG.md",
        "package.json"
      ],
      "excluded_run_outputs": [
        "docs/validation/2026-08-19-ce-post-3-20-full-window-name-status.md",
        "docs/validation/2026-08-19-ce-post-3-20-adjudication-input.json",
        "docs/validation/2026-08-19-ce-post-3-20-adjudication.json",
        "docs/validation/2026-08-19-ce-post-3-20-full-window-reconciliation-v2.json",
        "docs/validation/2026-08-19-ce-post-3-20-full-window-reconciliation-v2.md",
        "docs/validation/2026-08-19-spec-first-current-skill-package-inventory-v2.json",
        "docs/validation/2026-08-19-ce-post-3-20-evidence-exceptions.json",
        "docs/validation/2026-08-19-ce-post-3-20-ledger-patches/**",
        "docs/validation/ce-localization/**"
      ]
    },
    "hash_algorithm": {
      "name": "sha256",
      "version": "canonical-source-manifest-v1"
    }
  },
  "inventory_ref": "docs/validation/ce-localization/skill-inventory.json",
  "inventory_sha256": "b2611ecde0dc0d7aa15e599e8650f0739ff902d0b414d95d5b131d7d56f7b74d",
  "preflight_ref": "docs/validation/ce-localization/ce-setup-prerequisite-preflight.json",
  "preflight_sha256": "7789accec70d9735ed9fb397a6b20a4e361a852fcf6889cbca396848e323b763",
  "ce_tool_dispositions": [
    {
      "tool_id": "agent-browser",
      "disposition": "reuse",
      "reason_code": "local-required-nonblocking",
      "local_registry_kind": "helper",
      "local_required": true,
      "baseline_blocking": false,
      "source_ref": "skills/spec-runtime-setup/setup-registry.json",
      "status_authority": "plan-settled-and-source-checked"
    },
    {
      "tool_id": "ast-grep",
      "disposition": "reuse",
      "reason_code": "local-required-nonblocking",
      "local_registry_kind": "helper",
      "local_required": true,
      "baseline_blocking": false,
      "source_ref": "skills/spec-runtime-setup/setup-registry.json",
      "status_authority": "plan-settled-and-source-checked"
    },
    {
      "tool_id": "ast-grep-skill",
      "disposition": "reuse",
      "reason_code": "local-required-baseline",
      "local_registry_kind": "helper",
      "local_required": true,
      "baseline_blocking": false,
      "source_ref": "skills/spec-runtime-setup/setup-registry.json",
      "status_authority": "plan-settled-and-source-checked"
    },
    {
      "tool_id": "ffmpeg",
      "disposition": "reuse",
      "reason_code": "local-promoted-required",
      "local_registry_kind": "helper",
      "local_required": true,
      "baseline_blocking": false,
      "source_ref": "skills/spec-runtime-setup/setup-registry.json",
      "status_authority": "plan-settled-and-source-checked"
    },
    {
      "tool_id": "gh",
      "disposition": "reuse",
      "reason_code": "local-promoted-required",
      "local_registry_kind": "helper",
      "local_required": true,
      "baseline_blocking": false,
      "source_ref": "skills/spec-runtime-setup/setup-registry.json",
      "status_authority": "plan-settled-and-source-checked"
    },
    {
      "tool_id": "jq",
      "disposition": "reject",
      "reason_code": "no-active-local-consumer",
      "local_registry_kind": "not-registered",
      "local_required": false,
      "baseline_blocking": false,
      "source_ref": "docs/plans/2026-08-20-002-review-ce-localization-value-plan.md",
      "status_authority": "plan-settled-and-source-checked"
    }
  ],
  "dependencies": [
    {
      "dependency_id": "S1",
      "status": "confirmed",
      "reason_codes": [],
      "owner": "src/cli/runtime-setup-identity.js",
      "source_refs": [
        "src/cli/runtime-setup-identity.js"
      ],
      "test_refs": [
        "tests/unit/mcp-setup-entrypoint.test.js"
      ],
      "evidence_refs": [
        "docs/validation/ce-localization/ce-setup-prerequisite-preflight.json"
      ],
      "downstream_impact": "All Runtime Setup routes and host projections.",
      "next_action": "Keep forbidden executable aliases absent and rerun the entrypoint scan after projection changes.",
      "terminal_disposition": "reuse-spec-runtime-setup-only",
      "status_authority": "plan-settled-and-source-checked"
    },
    {
      "dependency_id": "S2",
      "status": "confirmed",
      "reason_codes": [],
      "owner": "skills/spec-runtime-setup/setup-registry.json",
      "source_refs": [
        "skills/spec-runtime-setup/setup-registry.json",
        "skills/spec-runtime-setup/setup-registry.schema.json"
      ],
      "test_refs": [
        "tests/unit/mcp-setup-registry.test.js"
      ],
      "evidence_refs": [
        "docs/validation/ce-localization/ce-setup-prerequisite-preflight.json"
      ],
      "downstream_impact": "Provider readiness, installation advice, and explicit --only selection.",
      "next_action": "Keep every CE tool candidate bound to the local registry decision and reject unowned additions.",
      "terminal_disposition": "confirmed-local-tool-dispositions",
      "status_authority": "deterministic-source-check"
    },
    {
      "dependency_id": "S3",
      "status": "confirmed",
      "reason_codes": [],
      "owner": "skills/spec-runtime-setup/scripts/lib/project-config.cjs",
      "source_refs": [
        "skills/spec-runtime-setup/scripts/lib/project-config.cjs"
      ],
      "test_refs": [
        "tests/unit/mcp-setup-project-config.test.js"
      ],
      "evidence_refs": [
        "docs/validation/ce-localization/ce-setup-prerequisite-preflight.json"
      ],
      "downstream_impact": "Project-local configuration consumers.",
      "next_action": "Preserve syntax, structure, and consumer ownership checks while leaving value semantics with each consumer.",
      "terminal_disposition": "confirmed-current-owner",
      "status_authority": "deterministic-source-check"
    },
    {
      "dependency_id": "S4",
      "status": "degraded",
      "reason_codes": [
        "provider-receipt-unverified"
      ],
      "owner": "skills/spec-runtime-setup/scripts/lib/facts.cjs",
      "source_refs": [
        "skills/spec-runtime-setup/scripts/lib/facts.cjs",
        "docs/contracts/verification/provider-serving-receipt.schema.json"
      ],
      "test_refs": [
        "tests/unit/mcp-setup-facts-renderer.test.js"
      ],
      "evidence_refs": [
        "docs/validation/ce-localization/ce-setup-prerequisite-preflight.json"
      ],
      "downstream_impact": "Doctor and actual Skill-local readiness adapters.",
      "next_action": "Keep missing or mismatched provider receipts degraded and prevent confirmed provider claims.",
      "terminal_disposition": "degraded-provider-unverified",
      "status_authority": "deterministic-source-check"
    },
    {
      "dependency_id": "S5",
      "status": "confirmed",
      "reason_codes": [],
      "owner": "src/cli/commands/doctor.js",
      "source_refs": [
        "src/cli/commands/doctor.js",
        "src/cli/helpers/setup-facts.js"
      ],
      "test_refs": [
        "tests/unit/doctor-output.test.js",
        "tests/unit/doctor-runtime-assets.test.js"
      ],
      "evidence_refs": [
        "docs/validation/ce-localization/ce-setup-prerequisite-preflight.json"
      ],
      "downstream_impact": "Human next actions and completion claims.",
      "next_action": "Preserve optional, known limitation, degraded, and not-run distinctions in machine and human output.",
      "terminal_disposition": "confirmed-current-projection",
      "status_authority": "deterministic-source-check"
    },
    {
      "dependency_id": "S6",
      "status": "confirmed",
      "reason_codes": [],
      "owner": "skills/spec-runtime-setup/scripts/lib/host-authority.cjs",
      "source_refs": [
        "skills/spec-runtime-setup/scripts/lib/host-authority.cjs"
      ],
      "test_refs": [
        "tests/unit/host-runtime-projection-contracts.test.js"
      ],
      "evidence_refs": [
        "docs/validation/ce-localization/ce-setup-prerequisite-preflight.json"
      ],
      "downstream_impact": "Host config mutation and generated runtime readiness claims.",
      "next_action": "Keep the production entrypoint bound to the actual loaded Skill root and reject pin/root mismatches.",
      "terminal_disposition": "confirmed-loaded-root-bound",
      "status_authority": "deterministic-source-check"
    },
    {
      "dependency_id": "S7",
      "status": "confirmed",
      "reason_codes": [],
      "owner": "scripts/check-ce-localization-review.cjs",
      "source_refs": [
        "skills/spec-runtime-setup/references/config-template.yaml",
        "src/verification/profile-loader.js"
      ],
      "test_refs": [
        "tests/unit/mcp-setup-config-consumers.test.js"
      ],
      "evidence_refs": [
        "docs/validation/ce-localization/ce-setup-prerequisite-preflight.json"
      ],
      "downstream_impact": "Only Skills with a confirmed facts or local-config read relationship.",
      "next_action": "Refresh exact source anchors after consumer changes and keep setup from becoming a global gate.",